{
  "$schema": "./schema.json",
  "project": "docs-mcp",
  "changelog_version": "1.0",
  "current_version": "1.12.0",
  "entries": [
    {
      "version": "1.12.0",
      "date": "2025-10-23",
      "summary": "Agent Handoff Automation - Auto-generate handoff context files to reduce agent transition time from 20-30 minutes to under 5 minutes",
      "changes": [
        {
          "id": "change-034",
          "type": "feature",
          "severity": "minor",
          "title": "Implemented /handoff command for automated agent context generation",
          "description": "Added generate_handoff_context tool with HandoffGenerator class that auto-generates claude.md files by parsing plan.json (workorder ID, goals, task status), analysis.json (tech stack), and git history (commits, uncommitted changes). Supports full and minimal modes via --mode parameter. Features: 3 parsers with graceful degradation, backup creation for existing files, 80%+ auto-population of context fields, phase detection from task status, template rendering with {{placeholder}} substitution. Includes comprehensive test suite (15 tests covering parsers, rendering, error handling, integration workflow) and /handoff slash command for quick access.",
          "files": [
            "generators/handoff_generator.py",
            "templates/handoff/claude-full.txt",
            "templates/handoff/claude-minimal.txt",
            "tool_handlers.py",
            "server.py",
            ".claude/commands/handoff.md",
            "tests/unit/handlers/test_handoff_handler.py",
            "CLAUDE.md",
            "my-guide.md"
          ],
          "reason": "Enable seamless agent transitions by automatically extracting and formatting context from existing project files. Eliminates manual context gathering (20-30 minutes) by auto-populating handoff documents from plan.json, analysis.json, and git history. Ensures consistent handoff documentation structure across all features and reduces friction in multi-agent workflows.",
          "impact": "Agents can now generate comprehensive handoff context in under 5 minutes (vs 20-30 minutes manual). Auto-populates 80%+ of context fields including workorder ID, project overview, current progress, task status, git commits, uncommitted changes, next steps, and tech stack. Supports both full mode (comprehensive context) and minimal mode (quick summary). Creates backups when updating existing claude.md files. Handles missing data sources gracefully with clear [DATA NOT AVAILABLE] markers.",
          "breaking": false,
          "workorder_id": "WO-HANDOFF-AUTOMATION-002"
        }
      ],
      "contributors": [
        "willh",
        "Claude Code AI (Agent 2)"
      ]
    },
    {
      "version": "1.11.0",
      "date": "2025-10-21",
      "summary": "Global Workorder Tracking System - Simple logging for feature completion",
      "changes": [
        {
          "id": "change-033",
          "type": "feature",
          "severity": "minor",
          "title": "Implemented global workorder logging system with 2 new tools",
          "description": "Added log_workorder and get_workorder_log tools for tracking workorder completion across projects. Simple one-line format (WO-ID | Project | Description | Timestamp) with reverse chronological order (latest entries at top). Features: prepend logic with read-then-write approach, auto-truncation at 50 chars for readability, workorder ID validation (^WO-[A-Z0-9-]+-\\d{3}$), and saved to coderef/workorder-log.txt. Includes 2 slash commands (/log-workorder, /get-workorder-log) for interactive logging and querying with project/pattern filters.",
          "files": [
            "tool_handlers.py",
            "constants.py",
            "validation.py",
            ".claude/commands/log-workorder.md",
            ".claude/commands/get-workorder-log.md",
            "coderef/workorder-log.txt",
            "CLAUDE.md",
            "README.md"
          ],
          "reason": "Provide simple global activity log for tracking workorder completion across all projects. Enables quick visibility into recent work, traceability for feature implementation, and integration with planning workflows. Complements existing workorder tracking in planning system (context.json, plan.json) with completion logging.",
          "impact": "Users can now log workorder entries to global log file with simple one-line format. Query log with project name or workorder pattern filters. View latest entries at top for quick visibility. Auto-truncation prevents long descriptions from breaking format. Workorder ID validation ensures consistent format. Slash commands provide interactive workflows for logging and querying.",
          "breaking": false
        }
      ],
      "contributors": [
        "willh",
        "Claude Code AI"
      ]
    },
    {
      "version": "2.0.1",
      "date": "2025-10-16",
      "summary": "Version 2.0.1 changes",
      "changes": [
        {
          "id": "change-028",
          "type": "enhancement",
          "severity": "major",
          "title": "Phase 1: Refactored all 21 handlers with decorator pattern",
          "description": "Applied @log_invocation and @mcp_error_handler decorators to all 21 MCP tool handlers, eliminating ~600 lines of repetitive try/except blocks and 21 manual log_tool_call() invocations. Created comprehensive test suite (29 tests) to validate decorator behavior. Achieved 100% backward compatibility with zero functionality changes.",
          "files": [
            "tool_handlers.py",
            "tests/unit/handlers/test_handler_decorators.py",
            "tests/unit/handlers/test_handler_helpers.py"
          ],
          "reason": "Reduce code duplication and improve maintainability across all MCP handlers. Repetitive error handling and logging patterns made the codebase harder to modify and maintain.",
          "impact": "Internal code quality improvement with zero user-facing changes. Future handlers will be easier to write (~30 minutes saved per new handler). All existing functionality preserved - 100% backward compatible.",
          "breaking": false
        },
        {
          "id": "change-029",
          "type": "enhancement",
          "severity": "major",
          "title": "Phase 2: Extracted decorators and helpers to separate modules",
          "description": "Completed Phase 2 of decorator refactor by extracting decorator implementations and helper functions from tool_handlers.py into dedicated modules. Created handler_decorators.py (188 lines) with @mcp_error_handler and @log_invocation decorators, and handler_helpers.py (49 lines) with format_success_response helper. This modular architecture improves code organization, reusability, and maintainability. Replaced 175 lines of inline definitions with 6 lines of imports in tool_handlers.py.",
          "files": [
            "handler_decorators.py",
            "handler_helpers.py",
            "tool_handlers.py"
          ],
          "reason": "Extract decorator implementations and helpers into separate modules to improve code organization, enable reusability across multiple files, and follow single responsibility principle. This modular architecture makes the codebase more maintainable and easier to test.",
          "impact": "Improved code modularity and maintainability. Decorators and helpers can now be easily imported and reused in other modules. Final metrics: reduced tool_handlers.py from 2168 to 1679 lines (-489 lines, -22.5% total reduction). All 29 tests passing with &lt;1ms performance overhead.",
          "breaking": false
        }
      ],
      "contributors": [
        "willh",
        "Claude Code AI"
      ]
    },
    {
      "version": "1.9.0",
      "date": "2025-10-15",
      "summary": "Phase 4: Configuration & Testing Inventory System",
      "changes": [
        {
          "id": "change-026",
          "type": "feature",
          "severity": "major",
          "title": "Phase 4A-4F: Configuration Inventory System - Multi-format Config Discovery",
          "description": "Implemented config_inventory tool (Tool #18) for discovering and analyzing configuration files across multiple formats. Features: (1) Format detection: JSON, YAML, TOML, INI, ENV (5+ formats). (2) File discovery with pattern matching (config.*, settings.*, .env*). (3) Format-specific parsers using standard libraries (json, pyyaml, toml, configparser, python-dotenv). (4) Sensitive value detection with regex patterns for API keys, passwords, tokens, secrets. (5) Automatic masking of sensitive values with [REDACTED] in manifest. (6) Security logging via log_security_event() when sensitive patterns detected. (7) Graceful handling of malformed config files. (8) Complete TypedDict coverage, input validation, error handling, and structured logging.",
          "files": [
            "generators/config_generator.py",
            "server.py",
            "tool_handlers.py",
            "constants.py",
            "type_defs.py",
            "coderef/inventory/config-schema.json",
            ".claude/commands/config-inventory.md",
            "requirements.txt"
          ],
          "reason": "Users need to discover and analyze configuration files for security auditing. Configuration files often contain sensitive values that must be detected and masked automatically to prevent leaks.",
          "impact": "Users can now scan projects for configuration files across 5+ formats, automatically detect sensitive values with masking, and generate comprehensive configuration inventories. Enables security auditing and configuration tracking workflows.",
          "breaking": false
        },
        {
          "id": "change-027",
          "type": "feature",
          "severity": "major",
          "title": "Phase 4G-4L: Test Inventory System - Multi-framework Test Discovery",